{
  "$schema": "https://json-schema.org/draft/2020-12/schema",
  "$id": "https://raw.githubusercontent.com/Girish-Garg/saboot/main/contracts/schemas/report_upload.schema.json",
  "title": "report_upload",
  "description": "Body of POST /reports, sent after the photo was PUT to the presigned URL. The worker also writes one for each frame it cuts from a scan video. The server re-checks everything; hints from the phone are never trusted.",
  "type": "object",
  "additionalProperties": false,
  "required": ["upload_id", "report_type", "context", "capture_mode", "gps", "device_token", "captured_at"],
  "properties": {
    "upload_id": {
      "type": "string",
      "pattern": "^upl_[a-z0-9_]{1,40}$",
      "description": "From POST /uploads/presign. The report id reuses its suffix: upl_x becomes rpt_x, so a retried POST is idempotent."
    },
    "report_type": { "enum": ["waste_dump", "no_bin", "contaminated_water", "open_construction"] },
    "context": {
      "enum": ["vacant_plot", "roadside", "drain", "other", "no_bin", "no_pickup", "stagnant", "sewage", "foam", "choked_drain", "uncovered_debris", "dusty_site"],
      "description": "Allowed values depend on report_type; see allOf."
    },
    "capture_mode": { "enum": ["snap", "scan"], "description": "snap: one photo, sent by the phone. scan: a frame the worker cut from a scan video (decision 20261010-0203)." },
    "scan": {
      "type": "object",
      "additionalProperties": false,
      "required": ["scan_id", "t_ms"],
      "description": "Set by the worker on every scan frame; the phone never sends it. Required when capture_mode is scan, forbidden when it is snap. gps is interpolated from the scan's gps_track at t_ms, and captured_at is started_at plus t_ms.",
      "properties": {
        "scan_id": { "type": "string", "pattern": "^scn_[a-z0-9_]{1,40}$" },
        "t_ms": { "type": "integer", "minimum": 0, "maximum": 60000, "description": "Frame time from the start of the video." }
      }
    },
    "sha256": {
      "type": "string",
      "pattern": "^[0-9a-f]{64}$",
      "description": "SHA-256 of the original image bytes, computed on the phone, lowercase hex."
    },
    "gps": {
      "type": "object",
      "additionalProperties": false,
      "required": ["lat", "lon", "accuracy_m"],
      "properties": {
        "lat": { "type": "number", "minimum": -90, "maximum": 90 },
        "lon": { "type": "number", "minimum": -180, "maximum": 180 },
        "accuracy_m": { "type": "number", "minimum": 0, "description": "Reported GPS accuracy radius in metres." }
      }
    },
    "device_token": {
      "type": "string",
      "pattern": "^[0-9a-f]{8}-[0-9a-f]{4}-4[0-9a-f]{3}-[89ab][0-9a-f]{3}-[0-9a-f]{12}$",
      "description": "Per-device token: a random UUID v4 the app creates once and keeps in IndexedDB. Keys reputation and rate limits."
    },
    "captured_at": { "type": "string", "format": "date-time", "description": "When the camera took the photo, ISO 8601 UTC." },
    "user_id": {
      "type": "string",
      "pattern": "^[A-Za-z0-9-]{1,128}$",
      "description": "Cognito sub of the signed-in reporter, opaque (decision 20261010-0227). The api sets it from the verified token and ignores any value the phone sends; scan frames copy it from the scan session. Absent only on guest reports made before accounts."
    },
    "note": { "type": "string", "maxLength": 280, "description": "Optional free text. Moderated for toxicity and personal data before it is shown." },
    "me_too_site_id": {
      "type": "string",
      "pattern": "^site_[a-z0-9_]{1,40}$",
      "description": "Set when the reporter tapped Me too on this site. The merger still checks distance and type."
    },
    "hints": {
      "type": "object",
      "description": "Phone-side model output, present only in edge mode; for a scan frame, the worker copies the phone detection at that frame. Hints for live boxes and frame selection only; never used as evidence.",
      "additionalProperties": false,
      "required": ["model", "waste_score", "recall_audit"],
      "properties": {
        "model": { "type": "string", "description": "On-phone model name and version." },
        "waste_score": { "type": "number", "minimum": 0, "maximum": 1 },
        "recall_audit": { "type": "boolean", "description": "True for the 1-in-20 confident-empty frame uploaded for recall audits." }
      }
    }
  },
  "allOf": [
    { "if": { "properties": { "capture_mode": { "const": "scan" } } }, "then": { "required": ["scan"] }, "else": { "not": { "required": ["scan"] } } },
    { "if": { "properties": { "report_type": { "const": "waste_dump" } } }, "then": { "properties": { "context": { "enum": ["vacant_plot", "roadside", "drain", "other"] } } } },
    { "if": { "properties": { "report_type": { "const": "no_bin" } } }, "then": { "properties": { "context": { "enum": ["no_bin", "no_pickup"] }, "gps": { "properties": { "accuracy_m": { "maximum": 50 } } } } } },
    { "if": { "properties": { "report_type": { "const": "no_bin" } } }, "then": { "description": "Decision 20261010-1630: a no_bin report says there is no dustbin within 1 km of where the reporter stands. The photo is optional: without sha256 there is no photo; upload_id is then made by the app (upl_ plus a lowercase ULID)." }, "else": { "required": ["sha256"] } },
    { "if": { "properties": { "report_type": { "const": "contaminated_water" } } }, "then": { "properties": { "context": { "enum": ["stagnant", "sewage", "foam", "choked_drain"] } } } },
    { "if": { "properties": { "report_type": { "const": "open_construction" } } }, "then": { "properties": { "context": { "enum": ["uncovered_debris", "dusty_site"] } } } }
  ]
}
