{
  "upload_id": "upl_jpr_1",
  "report_type": "open_construction",
  "context": "uncovered_debris",
  "capture_mode": "scan",
  "scan": { "scan_id": "scn_jpr_1", "t_ms": 4000 },
  "sha256": "788c3242b11bea71be7250fb1fc2a6aeb4c08b43b9d66d5cf75f443ddc303a75",
  "gps": { "lat": 26.85297, "lon": 75.81562, "accuracy_m": 14 },
  "device_token": "a71e5c90-2d3b-4f86-b1c4-9e0d27f58a63",
  "captured_at": "2026-10-10T04:02:10Z",
  "user_id": "c8a1f3e6-2b94-4d70-8e5f-1a6b9d3c7e20",
  "hints": { "model": "yolo-junk-nano-v0", "waste_score": 0.77, "recall_audit": false }
}
